LookupField,LookupValue,Definition,Synonym,BEDES,References,LookupStatus,LookupID,LookupFieldID,StatusChangeDate,RevisedDate,AddedInVersion,Wiki Page Title,Wiki Page URL,TextFieldLen
ListingTerms,Lease Option,The seller may be interested in selling as a lease option to the buyer.,,,'RESI,RLSE,RINC,LAND,MOBI,FARM,COMS,COML,BUSO',Active,333011,333000,20150721T0000,20150122T0000,1.4.0,Lease Option,http://ddwiki.reso.org/display/DDW16/Lease+Option,71
RoadSurfaceType,See Remarks,See the Public or Private Remarks for details on the road surface type.,,,'RESI,RLSE,RINC,LAND,MOBI,FARM',Active,412010,412000,20170806T0000,20161207T0000,1.6.0,See Remarks (RoadSurfaceType),http://ddwiki.reso.org/pages/viewpage.action?pageId=19405033,71
ScheduleType,Daily,The prospect (auto email) will be sent according to the Daily Schedule.,Every Day,,Prospecting Resource,Active,437002,437000,20170806T0000,20170502T0000,1.6.0,Daily (ScheduleType),http://ddwiki.reso.org/pages/viewpage.action?pageId=19405237,71
SpecialLicenses,Liquor 5 Years Or Less,The business being sold uses/requires a Liquor 5 years or less license.,,,BUSO,Active,343007,343000,20160621T0000,20150917T0000,1.4.0,Liquor 5 Years Or Less,http://ddwiki.reso.org/display/DDW16/Liquor+5+Years+Or+Less,71
SpecialLicenses,Liquor 5 Years Or More,The business being sold uses/requires a Liquor 5 years or more license.,,,BUSO,Active,343008,343000,20160621T0000,20150917T0000,1.4.0,Liquor 5 Years Or More,http://ddwiki.reso.org/display/DDW16/Liquor+5+Years+Or+More,71
StateOrProvince,NB,The Canadian province in which the listing is located is New Brunswick.,New Brunswick,,'RESI,RLSE,RINC,LAND,MOBI,FARM,COMS,COML,BUSO',Active,314056,314000,20150721T0000,20150122T0000,1.4.0,NB,http://ddwiki.reso.org/display/DDW16/NB,71
Vegetation,Other,There are other types of vegetation on the lot than those in this list.,,,'RESI,RLSE,RINC,LAND,MOBI,FARM',Active,422008,422000,20170806T0000,20161207T0000,1.6.0,Other (Vegetation),http://ddwiki.reso.org/pages/viewpage.action?pageId=19405370,71
BodyType,Double Wide,The body/structure type of the mobile/manufacture home is double wide.,,,MOBI,Active,351001,351000,20160621T0000,20151209T0000,1.5.0,Double Wide,http://ddwiki.reso.org/display/DDW16/Double+Wide,70
BodyType,See Remarks,The body/structure type of the mobile/manufacture home is see remarks.,,,MOBI,Active,351004,351000,20160621T0000,20151209T0000,1.5.0,See Remarks (BodyType),http://ddwiki.reso.org/pages/viewpage.action?pageId=19403174,70
BodyType,Single Wide,The body/structure type of the mobile/manufacture home is single wide.,,,MOBI,Active,351005,351000,20160621T0000,20151209T0000,1.5.0,Single Wide,http://ddwiki.reso.org/display/DDW16/Single+Wide,70
BodyType,Triple Wide,The body/structure type of the mobile/manufacture home is triple wide.,,,MOBI,Active,351006,351000,20160621T0000,20151209T0000,1.5.0,Triple Wide,http://ddwiki.reso.org/display/DDW16/Triple+Wide,70
ConstructionMaterials,ICFs (Insulated Concrete Forms),The structure was made wholly or partly with insulated concrete forms.,,,'RESI,RLSE,RINC,MOBI,FARM,COMS,COML',Active,355020,355000,20160621T0000,20151209T0000,1.5.0,ICFs (Insulated Concrete Forms),http://ddwiki.reso.org/pages/viewpage.action?pageId=19403404,70
CurrentUse,Other,The land is currently used for some use other than those in this list.,,,LAND,Active,394023,394000,20170806T0000,20161207T0000,1.6.0,Other (CurrentUse),http://ddwiki.reso.org/pages/viewpage.action?pageId=19403794,70
Electric,220 Volts in Workshop,The electrical features of the property include 220 volts in workshop.,,,'RESI,RLSE,RINC,LAND,MOBI,FARM',Active,358005,358000,20160621T0000,20160117T0000,1.5.0,220 Volts in Workshop,http://ddwiki.reso.org/display/DDW16/220+Volts+in+Workshop,70
Languages,Dari (Afghan Persian),The language spoken by the member/individual is Dari (Afghan Persian).,,,'Member,Contacts',Active,363042,363000,20160621T0000,20151209T0000,1.5.0,Dari (Afghan Persian),http://ddwiki.reso.org/pages/viewpage.action?pageId=19404220,70
Permission,Private,The image or document is private and should have limited distribution.,,,Media,Active,406005,406000,20170806T0000,20161207T0000,1.6.0,Private (Permission),http://ddwiki.reso.org/pages/viewpage.action?pageId=19404852,70
SpecialListingConditions,Short Sale,The listing is a short sale (short pay) and may require bank approval.,,,'RESI,RLSE,RINC,LAND,MOBI,FARM,COMS,COML,BUSO',Active,344007,344000,20150721T0000,20150122T0000,1.4.0,Short Sale,http://ddwiki.reso.org/display/DDW16/Short+Sale,70
StateOrProvince,SK,The Canadian province in which the listing is located is Saskatchewan.,Saskatchewan,,'RESI,RLSE,RINC,LAND,MOBI,FARM,COMS,COML,BUSO',Active,314064,314000,20150721T0000,20150122T0000,1.4.0,SK (StateOrProvince),http://ddwiki.reso.org/pages/viewpage.action?pageId=19405188,70
AccessibilityFeatures,Accessible Elevator Installed,Elevator with minimum 32" door and minimum  36" x 48" turning radius.,,,'RESI,RLSE,RINC,MOBI,FARM,COMS,COML',Active,389008,389000,20170806T0000,20161207T0000,1.6.0,Accessible Elevator Installed,http://ddwiki.reso.org/display/DDW16/Accessible+Elevator+Installed,69
AreaSource,Other,The measurement of the area was provided by another party not listed.,,,'RESI,RLSE,RINC,MOBI,FARM,COMS,COML',Active,349005,349000,20160621T0000,20151209T0000,1.5.0,Other,http://ddwiki.reso.org/display/DDW16/Other,69
AreaSource,See Remarks,See remarks for information about the source of the area measurement.,,,'RESI,RLSE,RINC,MOBI,FARM,COMS,COML',Active,349009,349000,20160621T0000,20151209T0000,1.5.0,See Remarks,http://ddwiki.reso.org/display/DDW16/See+Remarks,69
Attended,Agent,A licensed real estate agent will be present at the open house event.,Member,,OpenHouse,Active,321001,321000,20170806T0000,20170117T0000,1.4.0,Agent,http://ddwiki.reso.org/display/DDW16/Agent,69
CompensationType,$,The value entered in the BuyerAgencyCompensation field is in dollars.,'Dollar, Dollar Amount',,'RESI,RLSE,RINC,LAND,MOBI,FARM,COMS,COML,BUSO',Active,307001,307000,20151110T0000,20151110T0000,1.4.0,$,http://ddwiki.reso.org/pages/viewpage.action?pageId=19403371,69
Electric,220 Volts in Kitchen,The electrical features of the property include 220 volts in kitchen.,,,'RESI,RLSE,RINC,LAND,MOBI,FARM',Active,358003,358000,20160621T0000,20160117T0000,1.5.0,220 Volts in Kitchen,http://ddwiki.reso.org/display/DDW16/220+Volts+in+Kitchen,69
Electric,220 Volts in Laundry,The electrical features of the property include 220 volts in laundry.,,,'RESI,RLSE,RINC,LAND,MOBI,FARM',Active,358004,358000,20160621T0000,20160117T0000,1.5.0,220 Volts in Laundry,http://ddwiki.reso.org/display/DDW16/220+Volts+in+Laundry,69
Fencing,Other,The property has a type of fencing that is not included in this list.,,,'RESI,RLSE,RINC,LAND,MOBI,FARM,COMS,COML',Active,396015,396000,20170806T0000,20161207T0000,1.6.0,Other (Fencing),http://ddwiki.reso.org/pages/viewpage.action?pageId=19403981,69
FoundationDetails,Combination,The foundation of the property is made of a combination of materials.,,,'RESI,RLSE,RINC,MOBI,FARM,COMS,COML',Active,360003,360000,20160621T0000,20151209T0000,1.5.0,Combination,http://ddwiki.reso.org/display/DDW16/Combination,69
FoundationDetails,Stone,The foundation of the property is made wholly or partially of  stone.,,,'RESI,RLSE,RINC,MOBI,FARM,COMS,COML',Active,360011,360000,20160621T0000,20151209T0000,1.5.0,Stone (FoundationDetails),http://ddwiki.reso.org/pages/viewpage.action?pageId=19403959,69
Languages,Assyrian Neo-Aramaic,The language spoken by the member/individual is Assyrian Neo-Aramaic.,,,'Member,Contacts',Active,363011,363000,20160621T0000,20151209T0000,1.5.0,Assyrian Neo-Aramaic,http://ddwiki.reso.org/display/DDW16/Assyrian+Neo-Aramaic,69
Languages,Brazilian Portuguese,The language spoken by the member/individual is Brazilian Portuguese.,,,'Member,Contacts',Active,363023,363000,20160621T0000,20151209T0000,1.5.0,Brazilian Portuguese,http://ddwiki.reso.org/display/DDW16/Brazilian+Portuguese,69
LockBoxType,Call Listing Office,Call the listing office for information about accessing the property.,,,'RESI,RLSE,RINC,LAND,MOBI,FARM,COMS,COML,BUSO',Active,364001,364000,20160621T0000,20151209T0000,1.5.0,Call Listing Office (LockBoxType),http://ddwiki.reso.org/pages/viewpage.action?pageId=19404453,69
LockBoxType,See Remarks,See remarks for details about the lockbox and accessing the property.,,,'RESI,RLSE,RINC,LAND,MOBI,FARM,COMS,COML,BUSO',Active,364005,364000,20160621T0000,20151209T0000,1.5.0,See Remarks (LockBoxType),http://ddwiki.reso.org/pages/viewpage.action?pageId=19404457,69
OpenHouseType,Office,The open house is only open to the members of a particular office(s).,,,OpenHouse,Active,318003,318000,20150721T0000,20150122T0000,1.4.0,Office (OpenHouseType),http://ddwiki.reso.org/pages/viewpage.action?pageId=19404632,69
Possession,Close Plus 2 Days,Possession is passed to the buyer two days after the close of escrow.,COE+2,,'RESI,RLSE,RINC,LAND,MOBI,FARM,COMS,COML,BUSO',Active,341003,341000,20150721T0000,20150122T0000,1.4.0,Close Plus 2 Days,http://ddwiki.reso.org/display/DDW16/Close+Plus+2+Days,69
PropertySubType,Condominium,A unit within a structure where ownership is on a unit by unit basis.,'Condo, Unit, Flat, Condo/Townhouse, Condominium/Townhouse',,'RESI,RLSE',Active,302006,302000,20160621T0000,20160513T0000,1.5.0,Condominium,http://ddwiki.reso.org/display/DDW16/Condominium,69
Skirt,Synthetic,The mobile/manufactured home has a skirt made of synthetic materials.,,,MOBI,Active,371016,371000,20160621T0000,20151209T0000,1.5.0,Synthetic (Skirt),http://ddwiki.reso.org/pages/viewpage.action?pageId=19405093,69
SocialMediaType,StumbleUpon,SocialMedia[Type]UrlOrId has a URL or ID that relates to StumbleUpon.,,,'Member,Office,Contacts',Active,416013,416000,20170806T0000,20161207T0000,1.6.0,StumbleUpon,http://ddwiki.reso.org/display/DDW16/StumbleUpon,69
StateOrProvince,NS,The Canadian province in which the listing is located is Nova Scotia.,Nova Scotia,,'RESI,RLSE,RINC,LAND,MOBI,FARM,COMS,COML,BUSO',Active,314058,314000,20150721T0000,20150122T0000,1.4.0,NS,http://ddwiki.reso.org/display/DDW16/NS,69
Utilities,Sewer Available,Sewer service is available from the public utility but not connected.,,,'RESI,RLSE,RINC,LAND,MOBI,FARM,COMS,COML',Active,375017,375000,20160621T0000,20151209T0000,1.5.0,Sewer Available,http://ddwiki.reso.org/display/DDW16/Sewer+Available,69
Utilities,Water Available,Water service is available from the public utility but not connected.,,,'RESI,RLSE,RINC,LAND,MOBI,FARM,COMS,COML',Active,375021,375000,20160621T0000,20151209T0000,1.5.0,Water Available,http://ddwiki.reso.org/display/DDW16/Water+Available,69
WaterSource,See Remarks,'See the listing''s remarks for details on the property''s water source.',,,'RESI,RLSE,RINC,LAND,MOBI,FARM,COMS,COML',Active,376006,376000,20160621T0000,20151209T0000,1.5.0,See Remarks (WaterSource),http://ddwiki.reso.org/pages/viewpage.action?pageId=19405348,69
AssociationFeeIncludes,Earthquake Insurance,Earthquake Insurance is included in the fee paid to the Association.,,,'RESI,RLSE,RINC,LAND,MOBI',Active,320002,320000,20150721T0000,20150122T0000,1.4.0,Earthquake Insurance,http://ddwiki.reso.org/display/DDW16/Earthquake+Insurance,68
BodyType,Quad Wide,The body/structure type of the mobile/manufacture home is quad wide.,,,MOBI,Active,351003,351000,20160621T0000,20151209T0000,1.5.0,Quad Wide,http://ddwiki.reso.org/display/DDW16/Quad+Wide,68
ClassName,Business Opportunity,'The class, sometimes known as property type, is a business for sale.',,,'Media,HistoryTransactional,SavedSearch',Active,323001,323000,20150721T0000,20150812T0000,1.4.0,Business Opportunity,http://ddwiki.reso.org/display/DDW16/Business+Opportunity,68
DailySchedule,None,The prospect (auto email) has not been setup for any daily schedule.,No,,Prospecting Resource,Active,429005,429000,20170806T0000,20170502T0000,1.6.0,None (DailySchedule),http://ddwiki.reso.org/pages/viewpage.action?pageId=19403843,68
Electric,220 Volts in Garage,The electrical features of the property include 220 volts in garage.,,,'RESI,RLSE,RINC,LAND,MOBI,FARM',Active,358002,358000,20160621T0000,20160117T0000,1.5.0,220 Volts in Garage,http://ddwiki.reso.org/display/DDW16/220+Volts+in+Garage,68
FoundationDetails,Block,The foundation of the property is made wholly or partially of block.,,,'RESI,RLSE,RINC,MOBI,FARM,COMS,COML',Active,360001,360000,20160621T0000,20151209T0000,1.5.0,Block (FoundationDetails),http://ddwiki.reso.org/pages/viewpage.action?pageId=19403949,68
IncomeIncludes,Storage,The income amount includes income from charging for general storage.,,,'RINC,LAND',Active,329006,329000,20150721T0000,20150122T0000,1.4.0,Storage (IncomeIncludes),http://ddwiki.reso.org/pages/viewpage.action?pageId=19404171,68
Languages,Cape Verdean Creole,The language spoken by the member/individual is Cape Verdean Creole.,,,'Member,Contacts',Active,363029,363000,20160621T0000,20151209T0000,1.5.0,Cape Verdean Creole,http://ddwiki.reso.org/display/DDW16/Cape+Verdean+Creole,68
Languages,Norwegian (Nynorsk),The language spoken by the member/individual is Norwegian (Nynorsk).,,,'Member,Contacts',Active,363123,363000,20160621T0000,20151209T0000,1.5.0,Norwegian (Nynorsk),http://ddwiki.reso.org/pages/viewpage.action?pageId=19404319,68
OperatingExpenseIncludes,Professional Management,The operating expense amount includes professional management costs.,,,RINC,Active,339024,339000,20150721T0000,20150122T0000,1.4.0,Professional Management,http://ddwiki.reso.org/display/DDW16/Professional+Management,68
Possession,Close Plus 1 Day,Possession is passed to the buyer one day after the close of escrow.,COE+1,,'RESI,RLSE,RINC,LAND,MOBI,FARM,COMS,COML,BUSO',Active,341002,341000,20150721T0000,20150122T0000,1.4.0,Close Plus 1 Day,http://ddwiki.reso.org/display/DDW16/Close+Plus+1+Day,68
Possession,Close Plus 30 Days,Possession is passed to the buyer 30 days after the close of escrow.,,,'RESI,RLSE,RINC,LAND,MOBI,FARM,COMS,COML,BUSO',Active,341006,341000,20150721T0000,20150122T0000,1.4.0,Close Plus 30 Days,http://ddwiki.reso.org/display/DDW16/Close+Plus+30+Days,68
SocialMediaType,GooglePlus,SocialMedia[Type]UrlOrId has a URL or ID that relates to GooglePlus.,,,'Member,Office,Contacts',Active,416005,416000,20170806T0000,20161207T0000,1.6.0,GooglePlus,http://ddwiki.reso.org/display/DDW16/GooglePlus,68
StructureType,Cabin,A single family residence that may have limited utilities and rooms.,,,'RESI,RLSE',Active,438009,438000,20170806T0000,20170502T0000,1.6.0,Cabin (StructureType),http://ddwiki.reso.org/pages/viewpage.action?pageId=19405240,68
Utilities,Phone Connected,'Telephone service is physically connected, but not necessarily paid.',,,'RESI,RLSE,RINC,LAND,MOBI,FARM,COMS,COML',Active,375013,375000,20160621T0000,20151209T0000,1.5.0,Phone Connected,http://ddwiki.reso.org/display/DDW16/Phone+Connected,68
ConstructionMaterials,Board & Batten Siding,The structure was made wholly or partly with board & batten siding.,,,'RESI,RLSE,RINC,MOBI,FARM,COMS,COML',Active,355007,355000,20160621T0000,20151209T0000,1.5.0,Board & Batten Siding,http://ddwiki.reso.org/pages/viewpage.action?pageId=19403388,67
ConstructionMaterials,Spray Foam Insulation,The structure was made wholly or partly with spray foam insulation.,,,'RESI,RLSE,RINC,MOBI,FARM,COMS,COML',Active,355036,355000,20160621T0000,20151209T0000,1.5.0,Spray Foam Insulation,http://ddwiki.reso.org/display/DDW16/Spray+Foam+Insulation,67
EventType,Clicked on Phone Number,The Actor clicked on a phone number link associated with the Object,,,InternetTracking Resource,Active,432003,432000,20170806T0000,20170502T0000,1.6.0,Clicked on Phone Number,http://ddwiki.reso.org/display/DDW16/Clicked+on+Phone+Number,67
LeaseRenewalCompensation,Renewal Commission Paid,There is additional commission paid if the tenant renews the lease.,,,RLSE,Active,332005,332000,20150721T0000,20150122T0000,1.4.0,Renewal Commission Paid,http://ddwiki.reso.org/display/DDW16/Renewal+Commission+Paid,67
OperatingExpenseIncludes,Workmans Compensation,'The operating expense amount includes workman''s compensation costs.',,,RINC,Active,339033,339000,20150721T0000,20150122T0000,1.4.0,Workmans Compensation,http://ddwiki.reso.org/display/DDW16/Workmans+Compensation,67
OwnerPays,Other,The owner/lessor pays for items that are not included in this list.,,,'RLSE,RINC,COMS,COML',Active,366015,366000,20160621T0000,20151209T0000,1.5.0,Other (OwnerPays),http://ddwiki.reso.org/pages/viewpage.action?pageId=19404683,67
OwnershipType,Sole Proprietor,The ownership type of the business being sold is a sole proprietor.,,Ownership = [value],BUSO,Active,340004,340000,20150721T0000,20150122T0000,1.4.0,Sole Proprietor,http://ddwiki.reso.org/display/DDW16/Sole+Proprietor,67
Possession,Close Plus 3 Days,Possession is passed to the buyer 3 days after the close of escrow.,COE+3,,'RESI,RLSE,RINC,LAND,MOBI,FARM,COMS,COML,BUSO',Active,341004,341000,20150721T0000,20150122T0000,1.4.0,Close Plus 3 Days,http://ddwiki.reso.org/display/DDW16/Close+Plus+3+Days,67
PossibleUse,Other,The land could be used for a purpose other than those in this list.,,,LAND,Active,407019,407000,20170806T0000,20161207T0000,1.6.0,Other (PossibleUse),http://ddwiki.reso.org/pages/viewpage.action?pageId=19404874,67
Skirt,Unknown,The mobile/manufactured home has a skirt made of unknown materials.,,,MOBI,Active,371017,371000,20160621T0000,20151209T0000,1.5.0,Unknown (Skirt),http://ddwiki.reso.org/pages/viewpage.action?pageId=19405094,67
SocialMediaType,Instagram,SocialMedia[Type]UrlOrId has a URL or ID that relates to Instagram.,,,'Member,Office,Contacts',Active,416007,416000,20170806T0000,20161207T0000,1.6.0,Instagram,http://ddwiki.reso.org/display/DDW16/Instagram,67
SocialMediaType,Pinterest,SocialMedia[Type]UrlOrId has a URL or ID that relates to Pinterest.,,,'Member,Office,Contacts',Active,416009,416000,20170806T0000,20161207T0000,1.6.0,Pinterest,http://ddwiki.reso.org/display/DDW16/Pinterest,67
TenantPays,See Remarks,'See the listing''s remarks for details on what they tenant pays for.',,,'RLSE,RINC,COMS,COML',Active,374023,374000,20160621T0000,20151209T0000,1.5.0,See Remarks (TenantPays),http://ddwiki.reso.org/pages/viewpage.action?pageId=19405284,67
Utilities,Electricity Available,Electricity is available from the public utility but not connected.,,,'RESI,RLSE,RINC,LAND,MOBI,FARM,COMS,COML',Active,375004,375000,20160621T0000,20151209T0000,1.5.0,Electricity Available,http://ddwiki.reso.org/display/DDW16/Electricity+Available,67
Utilities,Natural Gas Available,Natural gas is available from the public utility but not connected.,,,'RESI,RLSE,RINC,LAND,MOBI,FARM,COMS,COML',Active,375007,375000,20160621T0000,20151209T0000,1.5.0,Natural Gas Available,http://ddwiki.reso.org/display/DDW16/Natural+Gas+Available,67
BodyType,Expando,The body/structure type of the mobile/manufacture home is Expando.,,,MOBI,Active,351002,351000,20160621T0000,20151209T0000,1.5.0,Expando,http://ddwiki.reso.org/display/DDW16/Expando,66
Electric,220 Volts For Spa,The electrical features of the property include 220 volts for spa.,,,'RESI,RLSE,RINC,LAND,MOBI,FARM',Active,358001,358000,20160621T0000,20160117T0000,1.5.0,220 Volts For Spa,http://ddwiki.reso.org/display/DDW16/220+Volts+For+Spa,66
LotSizeUnits,Square Meters,The value reported in the Lot Size Area field is in square meters.,,,'RESI,RLSE,RINC,LAND,MOBI,FARM,COMS,COML,BUSO',Active,312003,312000,20150721T0000,20150122T0000,1.4.0,Square Meters (LotSizeUnits),http://ddwiki.reso.org/pages/viewpage.action?pageId=19404474,66
OperatingExpenseIncludes,Furniture Replacement,The operating expense amount includes furniture replacement costs.,,,RINC,Active,339009,339000,20150721T0000,20150122T0000,1.4.0,Furniture Replacement,http://ddwiki.reso.org/display/DDW16/Furniture+Replacement,66
OperatingExpenseIncludes,Maintenance Structure,The operating expense amount includes maintenance structure costs.,,,RINC,Active,339016,339000,20150721T0000,20150122T0000,1.4.0,Maintenance Structure,http://ddwiki.reso.org/display/DDW16/Maintenance+Structure,66
ResourceName,Contacts,This record is related to another record in the Contacts resource.,,,'Media,HistoryTransactional,SavedSearch',Active,317004,317000,20150721T0000,20150812T0000,1.4.0,Contacts (ResourceName),http://ddwiki.reso.org/pages/viewpage.action?pageId=19404917,66
ResourceName,Property,This record is related to another record in the Property resource.,,,'Media,HistoryTransactional,SavedSearch',Active,317001,317000,20150721T0000,20150812T0000,1.4.0,Property,http://ddwiki.reso.org/display/DDW16/Property,66
SocialMediaType,Facebook,SocialMedia[Type]UrlOrId has a URL or ID that relates to Facebook.,,,'Member,Office,Contacts',Active,416003,416000,20170806T0000,20161207T0000,1.6.0,Facebook,http://ddwiki.reso.org/display/DDW16/Facebook,66
SocialMediaType,iMessage,SocialMedia[Type]UrlOrId has a URL or ID that relates to iMessage.,,,'Member,Office,Contacts',Active,416006,416000,20170806T0000,20161207T0000,1.6.0,iMessage,http://ddwiki.reso.org/display/DDW16/iMessage,66
SocialMediaType,LinkedIn,SocialMedia[Type]UrlOrId has a URL or ID that relates to LinkedIn.,,,'Member,Office,Contacts',Active,416008,416000,20170806T0000,20161207T0000,1.6.0,LinkedIn,http://ddwiki.reso.org/display/DDW16/LinkedIn,66
SocialMediaType,Snapchat,SocialMedia[Type]UrlOrId has a URL or ID that relates to Snapchat.,,,'Member,Office,Contacts',Active,416012,416000,20170806T0000,20161207T0000,1.6.0,Snapchat,http://ddwiki.reso.org/display/DDW16/Snapchat,66
StandardStatus,Pending,An offer has been accepted and the listing is no longer on market.,'Offer Accepted, Under Contract',,'RESI,RLSE,RINC,LAND,MOBI,FARM,COMS,COML,BUSO',Active,301003,301000,20111109T0000,20111109T0000,,Pending (StandardStatus),http://ddwiki.reso.org/pages/viewpage.action?pageId=19405132,66
StateOrProvince,MB,The Canadian province in which the listing is located is Manitoba.,Manitoba,,'RESI,RLSE,RINC,LAND,MOBI,FARM,COMS,COML,BUSO',Active,314055,314000,20150721T0000,20150122T0000,1.4.0,MB,http://ddwiki.reso.org/display/DDW16/MB,66
StateOrProvince,NU,The Canadian territory in which the listing is located is Nunavut.,Nunavut,,'RESI,RLSE,RINC,LAND,MOBI,FARM,COMS,COML,BUSO',Active,314060,314000,20150721T0000,20150122T0000,1.4.0,NU (StateOrProvince),http://ddwiki.reso.org/pages/viewpage.action?pageId=19405175,66
Utilities,Phone Available,The property has telephone service available but is not connected.,,,'RESI,RLSE,RINC,LAND,MOBI,FARM,COMS,COML',Active,375012,375000,20160621T0000,20151209T0000,1.5.0,Phone Available,http://ddwiki.reso.org/display/DDW16/Phone+Available,66
CurrentUse,See Remarks,See the Public or Private remarks for details on the current use.,,,LAND,Active,394033,394000,20170806T0000,20161207T0000,1.6.0,See Remarks (CurrentUse),http://ddwiki.reso.org/pages/viewpage.action?pageId=19403804,65
Electric,200+ Amp Service,The electrical features of the property include 200+ amp service.,,,'RESI,RLSE,RINC,LAND,MOBI,FARM',Active,358012,358000,20160621T0000,20160117T0000,1.5.0,200+ Amp Service,http://ddwiki.reso.org/pages/viewpage.action?pageId=19403864,65
Electric,Circuit Breakers,The electrical features of the property include circuit breakers.,,,'RESI,RLSE,RINC,LAND,MOBI,FARM',Active,358014,358000,20160621T0000,20160117T0000,1.5.0,Circuit Breakers,http://ddwiki.reso.org/display/DDW16/Circuit+Breakers,65
Languages,Southern Ndebele,The language spoken by the member/individual is Southern Ndebele.,,,'Member,Contacts',Active,363158,363000,20160621T0000,20151209T0000,1.5.0,Southern Ndebele,http://ddwiki.reso.org/display/DDW16/Southern+Ndebele,65
LotSizeSource,Public Records,The measurement of the lot size was received from public records.,,,'RESI,RLSE,RINC,LAND,MOBI,FARM,COMS,COML,BUSO',Active,365008,365000,20160621T0000,20151209T0000,1.5.0,Public Records (LotSizeSource),http://ddwiki.reso.org/pages/viewpage.action?pageId=19404469,65
OperatingExpenseIncludes,Capital Improvements,The operating expense amount includes capital improvements costs.,,,RINC,Active,339005,339000,20150721T0000,20150122T0000,1.4.0,Capital Improvements,http://ddwiki.reso.org/display/DDW16/Capital+Improvements,65
Possession,See Remarks,See the listing/agent remarks for more information on possession.,,,'RESI,RLSE,RINC,LAND,MOBI,FARM,COMS,COML,BUSO',Active,341009,341000,20150721T0000,20150122T0000,1.4.0,See Remarks (Possession),http://ddwiki.reso.org/pages/viewpage.action?pageId=19404792,65
RoomType,Exercise Room,A room that is specifically geared to contain exercise equipment.,,,'RESI,RLSE,MOBI,FARM',Active,304027,304000,20120420T0000,20120503T0000,,Exercise Room (RoomType),http://ddwiki.reso.org/pages/viewpage.action?pageId=19404971,65
SocialMediaType,Twitter,SocialMedia[Type]UrlOrId has a URL or ID that relates to Twitter.,,,'Member,Office,Contacts',Active,416015,416000,20170806T0000,20161207T0000,1.6.0,Twitter,http://ddwiki.reso.org/display/DDW16/Twitter,65
SocialMediaType,YouTube,SocialMedia[Type]UrlOrId has a URL or ID that relates to YouTube.,,,'Member,Office,Contacts',Active,416017,416000,20170806T0000,20161207T0000,1.6.0,YouTube,http://ddwiki.reso.org/display/DDW16/YouTube,65
StateOrProvince,AB,The Canadian province in which the listing is located is Alberta.,Alberta,,'RESI,RLSE,RINC,LAND,MOBI,FARM,COMS,COML,BUSO',Active,314053,314000,20150721T0000,20150122T0000,1.4.0,AB,http://ddwiki.reso.org/display/DDW16/AB,65
StateOrProvince,ON,The Canadian province in which the listing is located is Ontario.,Ontario,,'RESI,RLSE,RINC,LAND,MOBI,FARM,COMS,COML,BUSO',Active,314061,314000,20150721T0000,20150122T0000,1.4.0,ON,http://ddwiki.reso.org/display/DDW16/ON,65
ActorType,Consumer,The event was generated by what the source defines as a consumer,,,InternetTracking Resource,Active,427004,427000,20170806T0000,20170502T0000,1.6.0,Consumer,http://ddwiki.reso.org/display/DDW16/Consumer,64
