LookupField,LookupValue,Definition,Synonym,BEDES,References,LookupStatus,LookupID,LookupFieldID,StatusChangeDate,RevisedDate,AddedInVersion,Wiki Page Title,Wiki Page URL,TextFieldLen
CurrentFinancing,Leased Renewables,'Definition:  Renewable system (i.e., solar or wind) belonging to a third-party is installed on a customer’s property at little or no cost to the property owner. Property owner has entered an agreement to pay for the lease of the equipment. Structure:  Fee model is based on equipment to generate power, not power itself.  Transfer: If requirements are met it may be possible to transfer lease from home seller to buyer with the approval of the system owner. If being transferred, see Fannie Mae guidelines for more info: since lease is for equipment it must be included in the buyers DTI calculation.  If a buyer cannot or will not adopt a lease, then the seller is required to pay the remaining contract amount in full and the system would be removed.Real or Personal Property:  Renewable system is typically considered personal property.  All tax credits as well as maintenance responsibilities, etc. belong to the third-party owner. Some leases require the homeowner to pay the personal property tax.  Terms:  Lease should provide items homeowner is responsible for paying. In a solar lease model, a customer will sign a contract with an installer/developer and pay for the solar energy equipment over a period of years or decades. Solar leases can be structured so customers pay no up-front costs, some up-front costs (partially prepaid) or can be fully prepaid (the leasing company is then able to depreciate the equipment over time and offers a lower fee for pre-paid leases).  The homeowner may have the option to purchase the system during or at the end of the lease term (most leases are for 20-year terms) at its fair market value or terms set in the original lease contract.',,,'RESI,RLSE,RINC,LAND,MOBI,FARM,COMS,COML,BUSO',Active,326013,326000,20160621T0000,20160427T0000,1.5.0,Leased Renewables,http://ddwiki.reso.org/display/DDW16/Leased+Renewables,1685
CurrentFinancing,Property-Assessed Clean Energy,'Definition: Property-assessed clean energy (PACE) is a financing tool for property owners to fund energy or water efficiency or renewable energy installations. Structure: PACE is a secured loan that attaches to the property as a voluntary assessment on the property taxes.  To be eligible for a PACE loan, the building must be located in a local jurisdiction where the City or County has passed a resolution to participate in a PACE program. PACE financing is often a public-private partnership between a private finance company and a public agency.Transfer? The loan may be transferred to the new owner upon sale of the property with the approval of the system owner. Real or Personal Property? If seller owns and not a third-party, then renewable system is typically considered real property and tax credits and maintenance requirements, etc. belong to the property owner.  Terms:  Loan terms can vary between 5 and 30 years. Some programs also allow PACE to finance solar leases and power purchase agreements (PPAs). Due to the complexities of PACE financing, NAR and states like California have provided statements which are worth further consideration. NAR -  http://www.realtor.org/articles/administration-issues-pace-guidance; CAR - http://www.car.org/newsstand/newsreleases/2015releases/fhapacelien',PACE,,'RESI,RLSE,RINC,LAND,MOBI,FARM,COMS,COML,BUSO',Active,326015,326000,20160621T0000,20160427T0000,1.5.0,Property-Assessed Clean Energy,http://ddwiki.reso.org/display/DDW16/Property-Assessed+Clean+Energy,1306
CurrentFinancing,Power Purchase Agreement,'Definition:  Renewable system belonging to a third-party is installed on a customer’s property at little or no up-front cost to the property owner. Property owner is in an agreement to buy all the power generated at a fixed rate whether it is actually used or not.  This is typically lower than the local utility rate. Structure:  Fee model is based on power, not equipment to generate it. Transfer: A PPA may be transferred to a homebuyer with approval from the system owner. If a buyer will not adopt a PPA, then the seller is required to pay the remaining contract amount in full and the system would be removed. If being transferred, see Fannie Mae guidelines for more info:  portion of the purchase towards equipment must be included in the buyers DTI calculation.  Real or Personal Property: Renewable system is typically considered personal property.  All tax credits as well as maintenance responsibilities, etc. belong to the third-party owner. Terms: The customer agrees to purchase all energy produced by the system.  At the end of the PPA contract term (usually between 10-25 years), property owners can extend the contract and even buy the solar energy system from the developer based on terms in the contract.Additional info on SEIA.org.',,,'RESI,RLSE,RINC,LAND,MOBI,FARM,COMS,COML,BUSO',Active,326014,326000,20160621T0000,20160427T0000,1.5.0,Power Purchase Agreement,http://ddwiki.reso.org/display/DDW16/Power+Purchase+Agreement,1251
ConstructionMaterials,ICAT Recessed Lighting,'ICAT recessed light fixtures are rated both to safely come in contact with insulation and are better airsealed. ICAT is an acronym for Insulation Contact/AirTight. They can be installed safely with insulation and air sealing. These lights are different from IC (Insulation Contact) fixtures, which are not very airtight. They can also be identified by the wording “Washington State Approved.” Documentation on the installation is recommended because ICAT rating often requires multiple components be used as specified by the manufacturer. Substitutions of components can negate the rating. See: <a href="http://energy.gov/energysaver/articles/tips-lighting">http://energy.gov/energysaver/articles/tips-lighting</a> and <a href="http://energy.gov/energysaver/articles/tips-insulation">http://energy.gov/energysaver/articles/tips-insulation</a>',,,'RESI,RLSE,RINC,MOBI,FARM,COMS,COML',Active,355051,355000,20160621T0000,20160510T0000,1.5.0,ICAT Recessed Lighting,http://ddwiki.reso.org/display/DDW16/ICAT+Recessed+Lighting,842
AccessibilityFeatures,Accessible Full Bath,'Bathroom has adequate turnaround: 60 inches or other approved turnaround configuration.  Accessible bathing area:  Roll-in shower or space for shower chair or transfer bench in bathtub. Slip-resistant surface on bathroom floor and bathtub/shower.  Roll-under or side-access to sink, with padded trap. Lighting directly over shower/bathing areas, in addition to general bathroom lighting.  This is required to be considered Enhanced Accessible.  Optional: Removable cabinet doors and base under sink.  Grab bars with shear force of 250 pounds, installed around toilet and shower/tub, with proper backing.  Hand-held and/or height-adjustable shower head; automatic water temperature controlled (anti-scald) tub/shower; offset tub/shower controls toward front edge of tub/shower for easy access.   Raised toilet (17-19 inches minimum).',,,'RESI,RLSE,RINC,MOBI,FARM,COMS,COML',Active,389011,389000,20170806T0000,20161207T0000,1.6.0,Accessible Full Bath,http://ddwiki.reso.org/display/DDW16/Accessible+Full+Bath,832
GreenBuildingVerificationType,Home Energy Score,'The Home Energy Score, managed by the US DOE, is a national system that allows homes to receive an energy efficiency rating, similar to the MPG rating available for cars. The Home Energy Score uses a 10-point scale to reflect how much energy a home is expected to use under standard operating conditions. Homes that are expected to use the least amount of energy (and are considered the most energy efficient) score a 10, and homes that are expected to use the most amount of energy (and are considered the least energy efficient) score a 1. The Home Energy Score uses a standard calculation method and takes into account the home''s structure and envelope (walls, windows, foundation) and its heating, cooling, and hot water systems. Only Qualified Assessors who pass a DOE exam are allowed to provide the Home Energy Score.',,Assessment Program = "ENERGY STAR Certified Homes",'RESI,RLSE,RINC,MOBI,FARM,COMS,COML',Active,347014,347000,20160621T0000,20150917T0000,1.5.0,Home Energy Score,http://ddwiki.reso.org/display/DDW16/Home+Energy+Score,824
Electric,Ready for Renewables,'Indicates a comprehensive infrastructure is in place on the property to more easily incorporate an on-site electric generation facility in the future. Can be confirmed via supporting documentation such as a checklist provided by the DOE Zero Energy Ready Homes program. Solar-PV ready, for example, would often include extensive efficiency measures such as insulation and appliances, architectural drawings that design for a clear roof space, installing conduit from the attic to the electric panel, dedicated circuits on the electric panel, and leaving room near the panel for future components of a solar electric system, such as an inverter.  Local requirements may vary.  (source: DOE Zero Energy Ready Home http://energy.gov/sites/prod/files/2015/05/f22/PV-Ready%20Checklist.pdf )',,,'RESI,RLSE,RINC,LAND,MOBI,FARM',Active,358023,358000,20160621T0000,20160427T0000,1.5.0,Ready for RenewablesÂ ,http://ddwiki.reso.org/pages/viewpage.action?pageId=19403880,785
GreenBuildingVerificationType,LEED For Homes,'USGBC''s residential rating system, LEED for Homes, was launched in 2008. The LEED rating systems are developed through an open, consensus-based process led by LEED committees. LEED is a voluntary program that provides independent, third-party verification that a home was designed and built using methods for achieving high performance in multiple areas of sustainability including energy, water, waste management, indoor air quality, and sustainable site development. There are multiple rating systems for all types of buildings including Existing Buildings and Homes for residential projects. Homes may achieve different levels of certification (platinum, gold, silver, certified) depending on the number of LEED prerequisites and credits that are met.',,Assessment Program = "ENERGY STAR Certified Homes",'RESI,RLSE,RINC,MOBI,FARM,COMS,COML',Active,347005,347000,20160621T0000,20150917T0000,1.5.0,LEED For Homes,http://ddwiki.reso.org/display/DDW16/LEED+For+Homes,754
Levels,One and One Half,'A 1.5 story house is where the height of any of the walls on the second floor are less than the height of the walls on the first floor.  First floor walls that extend up to the second floor level are not included in the height comparison.  Depending on your State, Provence or other local regulations there may be a specific height difference required.  For example some areas required that the second floor walls be less than 70% the height of the first floor walls in order to be called a 1.5 story structure.  Other areas are 50% and it is clear that this may vary substantially from region to region.  Another common trait is angled ceilings that compensate for the short walls making all but the edges of the room high enough for normal use.','1.5, 1 1/2, One And A Half, 1.5 Stories, 1 1/2 Stories, One And One Half Stories, One And A Half Stories',,'RESI,RLSE,RINC,MOBI,FARM',Active,305005,305000,20170806T0000,20160913T0000,1.6,One and One Half,http://ddwiki.reso.org/display/DDW16/One+and+One+Half,746
GreenSustainability,Recycled Materials,'Structure includes multiple products that have a significant amount of postconsumer recycled content. Major green building programs tend to use 25 percent postconsumer recycled content as a threshold. Postindustrial recycled content tends to count toward overall content, but to a less scale. Some more common examples of recycled content materials include masonry, paving stones, or foundations with fly ash; aluminum gutters and downspouts; decking; drywall fibers, insulation, and house wrap; vinyl plastics; countertops; and cabinets, interior doors, or trim. More details are available on Home Innovation Research Labs “Browse Green Certified Products” tool or LEED Environmentally Preferred Products credit table.',,,'RESI,RLSE,RINC,MOBI,FARM,COMS,COML',Active,384003,384000,20160621T0000,20160513T0000,1.5.0,Recycled Materials,http://ddwiki.reso.org/display/DDW16/Recycled+Materials,719
GreenBuildingVerificationType,NGBS New Construction,'Home Innovation Research Labs certifies homes to the ICC-700 National Green Building Standard(tm) (NGBS), which has undergone the full consensus process and received approval from the American National Standards Institute (ANSI). Home Innovation Research Labs provides project certification to the NGBS. NGBS applies to both single-family homes and multifamily buildings. Certification options also exist for new construction, remodel projects (both whole-home and functional areas such as a kitchen or bathroom) and land development/subdivision. Homes may qualify for a bronze, silver, gold, or emerald certification level depending on the number of green building practices met.',,Assessment Program = "ENERGY STAR Certified Homes",'RESI,RLSE,RINC,MOBI,FARM,COMS,COML',Active,347006,347000,20160621T0000,20150917T0000,1.5.0,NGBS New Construction,http://ddwiki.reso.org/display/DDW16/NGBS+New+Construction,680
AccessibilityFeatures,Accessible Kitchen,'40" clear turn-around, or 36" clear with clear under-counter space for T-turn space in kitchen, unimpeded by fixtures.  Roll-under/adaptable sink with padded trap or side-access to sink. Roll-out shelves in at least 50% of lower cabinets, Roll-under work area (36" clearance). Lighting fixtures directed over all task areas with adaptable control.  This is required to be considered Enhanced Accessible.  Optional:  Adaptable under-sink cabinet with removable doors and cabinet base.  Accessible features for upper kitchen cabinets.  Space for side-by-side refrigerator (minimum 36 inches);  Contrasting color counter edges for vison accessibility.',,,'RESI,RLSE,RINC,MOBI,FARM,COMS,COML',Active,389013,389000,20170806T0000,20161207T0000,1.6.0,Accessible Kitchen,http://ddwiki.reso.org/display/DDW16/Accessible+Kitchen,648
StandardStatus,Coming Soon,'This is a listing that has not yet been on market but will be on market soon.  A listing contract has been executed.  Some systems may use Hold or Withdrawn for similar purposes.  When all three are in use, Hold expresses a listing that may have been on market but is off market temporarily and is expected to return to market.  Withdrawn may have been on market but when used in conjunction with Hold, is not expected to return to market.  Coming Soon is different from Hold and Withdrawn as the property, under the current listing contract only, has not been previously on market.',Delayed Showings,,'RESI,RLSE,RINC,LAND,MOBI,FARM,COMS,COML,BUSO',Active,301011,301000,20160621T0000,20150901T0000,1.4.0,Coming Soon,http://ddwiki.reso.org/display/DDW16/Coming+Soon,582
GreenBuildingVerificationType,NGBS Small Projects Remodel,'Home Innovation Research Labs provides project certification to the NGBS. NGBS applies to both single-family homes and multifamily buildings. Certification options also exist for new construction, remodel projects (both whole-home and functional areas such as a kitchen or bathroom), and land development/subdivision. For the Small Projects Remodel, the functional area (kitchen, bathroom, basement, addition) is either certified or not. Unlike other NGBS certifications, multiple certification levels (bronze, silver, gold, or emerald) do not exist for this certification option.',,Assessment Program = "ENERGY STAR Certified Homes",'RESI,RLSE,RINC,MOBI,FARM,COMS,COML',Active,347008,347000,20160621T0000,20150917T0000,1.5.0,NGBS Small Projects Remodel,http://ddwiki.reso.org/display/DDW16/NGBS+Small+Projects+Remodel,580
CommonInterest,Condominium,'Ownership of  an individual unit where each homeowner only owns their individual unit space, and an undivided share in the ownership of common areas or in a common homeowner’s association (HOA). Generally, the ownership of the individual unit is described in a Condominium Plan and usually consists of ownership of the surface of the walls and the space within.  The CC&Rs will detail what building components and other complex amenities are considered part of the common area and will describe the common area or HOA ownership percentages, and maintenance responsibilities.',,,'RESI,RLSE,RINC,LAND,MOBI,FARM,COMS,COML',Active,388001,388000,20170806T0000,20161024T0000,1.6.0,Condominium (CommonInterest),http://ddwiki.reso.org/pages/viewpage.action?pageId=19403704,574
GreenWaterConservation,Efficient Hot Water Distribution,'Efficient hot water distribution systems are designed to generate hot water using fewer fuel resources, and to get hot water to low-flow faucets and fixtures more quickly. These systems often feature carefully designed plumbing lines that are less redundant and/or shorter. Rather than measuring time to hot water at a fixture in gallons, efficient distribution systems can be measured in cups. EPA WaterSense Guide for Hot Water Distribution as well as several green building programs have further details. This may also be known as Structured Plumbing.',,,'RESI,RLSE,RINC,MOBI,FARM,COMS,COML',Active,385005,385000,20160621T0000,20160513T0000,1.5.0,Efficient Hot Water Distribution,http://ddwiki.reso.org/display/DDW16/Efficient+Hot+Water+Distribution,554
GreenWaterConservation,Green Infrastructure,'Green Infrastructure is a set of strategies and specifically designed systems to manage stormwater runoff through a variety of small, cost-effective landscape features located on a property. Green Infrastructure employs infiltration (allowing water to slowly sink into the soil), evaporation/transpiration using native vegetation, and rainwater capture and reuse (storing runoff to water plants, flush toilets, etc.). May include green roof, rain gardens, rain barrels, permeable paving, etc. EPA Green Infrastructure webpage has more information',,,'RESI,RLSE,RINC,MOBI,FARM,COMS,COML',Active,385002,385000,20160621T0000,20160513T0000,1.5.0,Green Infrastructure,http://ddwiki.reso.org/display/DDW16/Green+Infrastructure,546
BuyerAgentDesignation,Certified Real Estate Team Specialist / C-RETS,'The Certified Real Estate Team Specialist certification is designed to improve team development, individual leadership skills, and financial performance. The courses provide the tools, strategies, and knowledge that are required of today’s real estate professionals who are either considering or currently operating in a team environment. It is for team leaders, team members, those looking to start a team, and those who simply want to sharpen their management skills.  https://www.nar.realtor/designations-and-certifications/c-rets',,,'RESI,RLSE,RINC,LAND,MOBI,FARM,COMS,COML,BUSO',Active,390009,390000,20170806T0000,20161207T0000,1.6.0,Certified Real Estate Team Specialist / C-RETS,http://ddwiki.reso.org/pages/viewpage.action?pageId=19403312,533
CoBuyerAgentDesignation,Certified Real Estate Team Specialist / C-RETS,'The Certified Real Estate Team Specialist certification is designed to improve team development, individual leadership skills, and financial performance. The courses provide the tools, strategies, and knowledge that are required of today’s real estate professionals who are either considering or currently operating in a team environment. It is for team leaders, team members, those looking to start a team, and those who simply want to sharpen their management skills.  https://www.nar.realtor/designations-and-certifications/c-rets',,,'RESI,RLSE,RINC,LAND,MOBI,FARM,COMS,COML,BUSO',Active,391009,391000,20170806T0000,20161207T0000,1.6.0,Certified Real Estate Team Specialist / C-RETS (CoBuyerAgentDesignation),http://ddwiki.reso.org/pages/viewpage.action?pageId=19403724,533
CoListAgentDesignation,Certified Real Estate Team Specialist / C-RETS,'The Certified Real Estate Team Specialist certification is designed to improve team development, individual leadership skills, and financial performance. The courses provide the tools, strategies, and knowledge that are required of today’s real estate professionals who are either considering or currently operating in a team environment. It is for team leaders, team members, those looking to start a team, and those who simply want to sharpen their management skills.  https://www.nar.realtor/designations-and-certifications/c-rets',,,'RESI,RLSE,RINC,LAND,MOBI,FARM,COMS,COML,BUSO',Active,392009,392000,20170806T0000,20161207T0000,1.6.0,Certified Real Estate Team Specialist / C-RETS (CoListAgentDesignation),http://ddwiki.reso.org/pages/viewpage.action?pageId=19403752,533
GreenBuildingVerificationType,Home Energy Upgrade Certificate of Energy Efficiency Performance,'Buildings Performance Institute BPI- 2101 Standard Requirements for a Certificate of Completion for Whole-House Energy Efficiency Upgrades specifies a standard way of describing the improvements made to an existing home through a home energy upgrade (HEU) and provides one or more measures of a home''s performance. Measures of performance may include a HERS rating, a Home Energy Score, an indication of projected or actual energy consumption, or other systems. Certificates are provided by a local energy efficiency program sponsor.',,Assessment Program = "ENERGY STAR Certified Homes",'RESI,RLSE,RINC,MOBI,FARM,COMS,COML',Active,347017,347000,20160621T0000,20150917T0000,1.5.0,Home Energy Upgrade Certificate of Energy Efficiency Performance,http://ddwiki.reso.org/display/DDW16/Home+Energy+Upgrade+Certificate+of+Energy+Efficiency+Performance,533
ListAgentDesignation,Certified Real Estate Team Specialist / C-RETS,'The Certified Real Estate Team Specialist certification is designed to improve team development, individual leadership skills, and financial performance. The courses provide the tools, strategies, and knowledge that are required of today’s real estate professionals who are either considering or currently operating in a team environment. It is for team leaders, team members, those looking to start a team, and those who simply want to sharpen their management skills.  https://www.nar.realtor/designations-and-certifications/c-rets',,,'RESI,RLSE,RINC,LAND,MOBI,FARM,COMS,COML,BUSO',Active,399009,399000,20170806T0000,20161207T0000,1.6.0,Certified Real Estate Team Specialist / C-RETS (ListAgentDesignation),http://ddwiki.reso.org/pages/viewpage.action?pageId=19404488,533
MemberDesignation,Certified Real Estate Team Specialist / C-RETS,'The Certified Real Estate Team Specialist certification is designed to improve team development, individual leadership skills, and financial performance. The courses provide the tools, strategies, and knowledge that are required of today’s real estate professionals who are either considering or currently operating in a team environment. It is for team leaders, team members, those looking to start a team, and those who simply want to sharpen their management skills.  https://www.nar.realtor/designations-and-certifications/c-rets',,,Member,Active,401009,401000,20170806T0000,20161207T0000,1.6.0,Certified Real Estate Team Specialist / C-RETS (MemberDesignation),http://ddwiki.reso.org/pages/viewpage.action?pageId=19404572,533
Electric,Net Meter,'Net metering is an electric service that allows electricity generated on a consumer’s site (“on-site”) to offset that consumer’s use.  This generation can include (generally small) renewable energy facilities (such as wind, solar power, fuel cells or hydro).  Net meters might also be used with energy storage devices such as batteries (stand alone or for electric vehicles). Net meters can “spin backwards” such that at the end of the billing period, the consumer only pays for its use, less what it produced (i.e., the “net”).',,,'RESI,RLSE,RINC,LAND,MOBI,FARM',Active,358024,358000,20160621T0000,20160427T0000,1.5.0,Net Meter,http://ddwiki.reso.org/display/DDW16/Net+Meter,528
GreenWaterConservation,Water-Smart Landscaping,Water-smart landscapes are designed to require less water and fertilizer treatments. These landscapes feature regionally appropriate plants that require low water and are native to the local climate. Plants are organized by hydrozones (watering needs). Any irrigation system is qualified for high water-efficiency. Turfgrass is minimized and grown to the tallest height recommended. Strategic maintenance includes mulching and soil aeration. Other details are documented in EPA’s Water-Smart Landscape Design Tips.,,,'RESI,RLSE,RINC,MOBI,FARM,COMS,COML',Active,385001,385000,20160621T0000,20160513T0000,1.5.0,Water-Smart Landscaping,http://ddwiki.reso.org/display/DDW16/Water-Smart+Landscaping,514
GreenBuildingVerificationType,ENERGY STAR Certified Homes,'EPA ENERGY STAR Certified Homes is a set of optional construction practices and technologies (above minimum code requirements) that builders can follow to upgrade a new home''s energy efficiency beyond minimum code requirements. Guidelines are outlined in the National Performance Path; or the National Prescriptive Path; This whole-house label differs from the ENERGY STAR products label. To achieve the ENERGY STAR Certified Homes label, a home''s energy efficiency must be verified by a third-party organization.',,Assessment Program = "ENERGY STAR Certified Homes",'RESI,RLSE,RINC,MOBI,FARM,COMS,COML',Active,347002,347000,20160621T0000,20150917T0000,1.5.0,ENERGY STAR Certified Homes,http://ddwiki.reso.org/display/DDW16/ENERGY+STAR+Certified+Homes,513
