LookupField,LookupValue,Definition,Synonym,BEDES,References,LookupStatus,LookupID,LookupFieldID,StatusChangeDate,RevisedDate,AddedInVersion,Wiki Page Title,Wiki Page URL,TextFieldLen
Languages,Thai,The language spoken by the member/individual is Thai.,,,'Member,Contacts',Active,363170,363000,20160621T0000,20151209T0000,1.5.0,Thai,http://ddwiki.reso.org/display/DDW16/Thai,53
Languages,Urdu,The language spoken by the member/individual is Urdu.,,,'Member,Contacts',Active,363180,363000,20160621T0000,20151209T0000,1.5.0,Urdu,http://ddwiki.reso.org/display/DDW16/Urdu,53
Languages,Zulu,The language spoken by the member/individual is Zulu.,,,'Member,Contacts',Active,363190,363000,20160621T0000,20151209T0000,1.5.0,Zulu,http://ddwiki.reso.org/display/DDW16/Zulu,53
LotSizeSource,Builder,The builder provided the measurement of the lot size.,,,'RESI,RLSE,RINC,LAND,MOBI,FARM,COMS,COML,BUSO',Active,365003,365000,20160621T0000,20151209T0000,1.5.0,Builder (LotSizeSource),http://ddwiki.reso.org/pages/viewpage.action?pageId=19404464,53
ObjectIdType,ListingKeyNumeric,The Object is a numeric key field from an MLS system.,,,InternetTracking Resource,Active,434003,434000,20170806T0000,20170502T0000,1.6.0,ListingKeyNumeric (ObjectIdType),http://ddwiki.reso.org/pages/viewpage.action?pageId=19404759,53
OfficeType,Realtor Office,The record in the office roster is an realtor office.,,,Office,Active,338011,338000,20150721T0000,20150122T0000,1.4.0,Realtor Office,http://ddwiki.reso.org/display/DDW16/Realtor+Office,53
OpenHouseStatus,Active,The open house is active and continuing as scheduled.,,,OpenHouse,Active,318004,318000,20160621T0000,20151106T0000,1.4.0,Active (OpenHouseStatus),http://ddwiki.reso.org/pages/viewpage.action?pageId=19404627,53
OperatingExpenseIncludes,Cable TV,The operating expense amount includes cable TV costs.,,,RINC,Active,339004,339000,20150721T0000,20150122T0000,1.4.0,Cable TV (OperatingExpenseIncludes),http://ddwiki.reso.org/pages/viewpage.action?pageId=19404638,53
OperatingExpenseIncludes,Gardener,The operating expense amount includes gardener costs.,,,RINC,Active,339010,339000,20150721T0000,20150122T0000,1.4.0,Gardener,http://ddwiki.reso.org/display/DDW16/Gardener,53
OperatingExpenseIncludes,Licenses,The operating expense amount includes licenses costs.,,,RINC,Active,339013,339000,20150721T0000,20150122T0000,1.4.0,Licenses,http://ddwiki.reso.org/display/DDW16/Licenses,53
OperatingExpenseIncludes,Pool/Spa,The operating expense amount includes pool/spa costs.,,,RINC,Active,339023,339000,20150721T0000,20150122T0000,1.4.0,Pool/Spa,http://ddwiki.reso.org/pages/viewpage.action?pageId=19404657,53
OperatingExpenseIncludes,Security,The operating expense amount includes security costs.,,,RINC,Active,339025,339000,20150721T0000,20150122T0000,1.4.0,Security (OperatingExpenseIncludes),http://ddwiki.reso.org/pages/viewpage.action?pageId=19404659,53
OperatingExpenseIncludes,Supplies,The operating expense amount includes supplies costs.,,,RINC,Active,339028,339000,20150721T0000,20150122T0000,1.4.0,Supplies,http://ddwiki.reso.org/display/DDW16/Supplies,53
PossibleUse,Highway/Tourist Service,The land could be used for a highway/tourist service.,,,LAND,Active,407009,407000,20170806T0000,20161207T0000,1.6.0,Highway/Tourist Service (PossibleUse),http://ddwiki.reso.org/pages/viewpage.action?pageId=19404864,53
PreferredPhone,Toll Free,The contact prefers the use of their toll free phone.,,,Contacts,Active,409006,409000,20170806T0000,20161207T0000,1.6.0,Toll Free (PreferredPhone),http://ddwiki.reso.org/pages/viewpage.action?pageId=19404899,53
PreferredPhone,Voicemail,The contact prefers the use of their voicemail phone.,,,Contacts,Active,409007,409000,20170806T0000,20161207T0000,1.6.0,Voicemail (PreferredPhone),http://ddwiki.reso.org/pages/viewpage.action?pageId=19404900,53
PropertySubType,Manufactured Home,A factory built house that is transported to the lot.,Manuf Homes,,'RESI,RLSE,MOBI',Active,302009,302000,20160621T0000,20160222T0000,1.5.0,Manufactured Home,http://ddwiki.reso.org/display/DDW16/Manufactured+Home,53
Roof,Mixed,The roof is made wholly/partially of mixed materials.,,,'RESI,RLSE,RINC,MOBI,FARM,COMS,COML',Active,369020,369000,20160621T0000,20151209T0000,1.5.0,Mixed (Roof),http://ddwiki.reso.org/pages/viewpage.action?pageId=19404941,53
Room[type]LengthWidthSource,GIS Calculated,The length and width of the room were GIS calculated.,,,'RESI,RLSE,MOBI,FARM',Active,413005,413000,20170806T0000,20161207T0000,1.6.0,GIS Calculated (Room[type]LengthWidthSource),http://ddwiki.reso.org/pages/viewpage.action?pageId=19405040,53
SpecialLicenses,None,The business being sold uses/requires/has no license.,,,BUSO,Active,343011,343000,20150721T0000,20150122T0000,1.4.0,None (SpecialLicenses),http://ddwiki.reso.org/pages/viewpage.action?pageId=19405108,53
StateOrProvince,AL,The state in which the listing is located is Alabama.,'Alabama, Ala.',,'RESI,RLSE,RINC,LAND,MOBI,FARM,COMS,COML,BUSO',Active,314002,314000,20150721T0000,20150122T0000,1.4.0,AL (StateOrProvince),http://ddwiki.reso.org/pages/viewpage.action?pageId=19405137,53
StateOrProvince,AZ,The state in which the listing is located is Arizona.,'Arizona, Ariz.',,'RESI,RLSE,RINC,LAND,MOBI,FARM,COMS,COML,BUSO',Active,314004,314000,20150721T0000,20150122T0000,1.4.0,AZ (StateOrProvince),http://ddwiki.reso.org/pages/viewpage.action?pageId=19405139,53
StateOrProvince,FL,The state in which the listing is located is Florida.,'Florida, Fla.',,'RESI,RLSE,RINC,LAND,MOBI,FARM,COMS,COML,BUSO',Active,314010,314000,20150721T0000,20150122T0000,1.4.0,FL,http://ddwiki.reso.org/display/DDW16/FL,53
StateOrProvince,GA,The state in which the listing is located is Georgia.,'Georgia, Ga.',,'RESI,RLSE,RINC,LAND,MOBI,FARM,COMS,COML,BUSO',Active,314011,314000,20150721T0000,20150122T0000,1.4.0,GA (StateOrProvince),http://ddwiki.reso.org/pages/viewpage.action?pageId=19405147,53
StateOrProvince,IN,The state in which the listing is located is Indiana.,'Indiana, Ind.',,'RESI,RLSE,RINC,LAND,MOBI,FARM,COMS,COML,BUSO',Active,314016,314000,20150721T0000,20150122T0000,1.4.0,IN (StateOrProvince),http://ddwiki.reso.org/pages/viewpage.action?pageId=19405152,53
StateOrProvince,MT,The state in which the listing is located is Montana.,'Montana, Mont.',,'RESI,RLSE,RINC,LAND,MOBI,FARM,COMS,COML,BUSO',Active,314027,314000,20150721T0000,20150122T0000,1.4.0,MT (StateOrProvince),http://ddwiki.reso.org/pages/viewpage.action?pageId=19405164,53
StateOrProvince,VT,The state in which the listing is located is Vermont.,'Vermont, Vt.',,'RESI,RLSE,RINC,LAND,MOBI,FARM,COMS,COML,BUSO',Active,314048,314000,20150721T0000,20150122T0000,1.4.0,VT,http://ddwiki.reso.org/display/DDW16/VT,53
StateOrProvince,WY,The state in which the listing is located is Wyoming.,'Wyoming, Wyo.',,'RESI,RLSE,RINC,LAND,MOBI,FARM,COMS,COML,BUSO',Active,314052,314000,20150721T0000,20150122T0000,1.4.0,WY,http://ddwiki.reso.org/display/DDW16/WY,53
WaterSource,Spring,'The property''s source of water has/includes a spring.',,,'RESI,RLSE,RINC,LAND,MOBI,FARM,COMS,COML',Active,376008,376000,20160621T0000,20151209T0000,1.5.0,Spring,http://ddwiki.reso.org/display/DDW16/Spring,53
Concessions,No,There are no concessions included with this listing.,,,'RESI,RLSE,RINC,LAND,MOBI,FARM,COMS,COML,BUSO',Active,354002,354000,20160621T0000,20151209T0000,1.5.0,No,http://ddwiki.reso.org/display/DDW16/No,52
ConstructionMaterials,Stucco,The structure was made wholly or partly with stucco.,,,'RESI,RLSE,RINC,MOBI,FARM,COMS,COML',Active,355041,355000,20160621T0000,20151209T0000,1.5.0,Stucco,http://ddwiki.reso.org/display/DDW16/Stucco,52
CurrentUse,Residential,The land is currently used for residential purposes.,,,LAND,Active,394030,394000,20170806T0000,20161207T0000,1.6.0,Residential (CurrentUse),http://ddwiki.reso.org/pages/viewpage.action?pageId=19403801,52
DevelopmentStatus,Site Plan Approved,The site plan has been approved for the development.,,,LAND,Active,395008,395000,20170806T0000,20161207T0000,1.6.0,Site Plan Approved,http://ddwiki.reso.org/display/DDW16/Site+Plan+Approved,52
FeeFrequency,One Time,Fee is paid or received once and is not reoccurring.,,,'RESI,RLSE,RINC,LAND,MOBI,FARM',Active,303011,303000,20111109T0000,20111109T0000,,One Time,http://ddwiki.reso.org/display/DDW16/One+Time,52
Languages,Kru,The language spoken by the member/individual is Kru.,,,'Member,Contacts',Active,363096,363000,20160621T0000,20151209T0000,1.5.0,Kru,http://ddwiki.reso.org/display/DDW16/Kru,52
Languages,Lao,The language spoken by the member/individual is Lao.,,,'Member,Contacts',Active,363098,363000,20160621T0000,20151209T0000,1.5.0,Lao,http://ddwiki.reso.org/display/DDW16/Lao,52
Languages,Twi,The language spoken by the member/individual is Twi.,,,'Member,Contacts',Active,363177,363000,20160621T0000,20151209T0000,1.5.0,Twi,http://ddwiki.reso.org/display/DDW16/Twi,52
LinearUnits,Meters,The elevation of the property is measured in meters.,,,'RESI,RLSE,RINC,LAND,MOBI,FARM',Active,359002,359000,20160621T0000,20151209T0000,1.5.0,Meters,http://ddwiki.reso.org/display/DDW16/Meters,52
ListingTerms,Trade,The seller may be interested in a trade arrangement.,,,'RESI,RLSE,RINC,LAND,MOBI,FARM,COMS,COML,BUSO',Active,333022,333000,20150721T0000,20150122T0000,1.4.0,Trade,http://ddwiki.reso.org/display/DDW16/Trade,52
OperatingExpenseIncludes,Manager,The operating expense amount includes manager costs.,,,RINC,Active,339017,339000,20150721T0000,20150122T0000,1.4.0,Manager,http://ddwiki.reso.org/display/DDW16/Manager,52
OperatingExpenseIncludes,New Tax,The operating expense amount includes new tax costs.,,,RINC,Active,339019,339000,20150721T0000,20150122T0000,1.4.0,New Tax,http://ddwiki.reso.org/display/DDW16/New+Tax,52
OperatingExpenseIncludes,Parking,The operating expense amount includes parking costs.,,,RINC,Active,339021,339000,20150721T0000,20150122T0000,1.4.0,Parking (OperatingExpenseIncludes),http://ddwiki.reso.org/pages/viewpage.action?pageId=19404655,52
PropertySubType,Office,The property is designed to be used as office space.,,,'COMS,COML',Active,302026,302000,20170806T0000,20161024T0000,1.6.0,Office (PropertySubType),http://ddwiki.reso.org/pages/viewpage.action?pageId=19404833,52
PropertySubType,Warehouse,The property is designed to be used for warehousing.,,,'COMS,COML',Active,302029,302000,20170806T0000,20161024T0000,1.6.0,Warehouse (PropertySubType),http://ddwiki.reso.org/pages/viewpage.action?pageId=19404836,52
Roof,Rolled/Hot Mop,The roof is made wholly/partially of rolled/hot mop.,,,'RESI,RLSE,RINC,MOBI,FARM,COMS,COML',Active,369023,369000,20160621T0000,20151209T0000,1.5.0,Rolled/Hot Mop,http://ddwiki.reso.org/pages/viewpage.action?pageId=19404944,52
SpecialListingConditions,Notice Of Default,There is a notice of default on the listed property.,NOD,,'RESI,RLSE,RINC,LAND,MOBI,FARM,COMS,COML,BUSO',Active,344004,344000,20150721T0000,20150122T0000,1.4.0,Notice Of Default,http://ddwiki.reso.org/display/DDW16/Notice+Of+Default,52
StateOrProvince,AK,The state in which the listing is located is Alaska.,Alaska,,'RESI,RLSE,RINC,LAND,MOBI,FARM,COMS,COML,BUSO',Active,314001,314000,20150721T0000,20150122T0000,1.4.0,AK,http://ddwiki.reso.org/display/DDW16/AK,52
StateOrProvince,HI,The state in which the listing is located is Hawaii.,Hawaii,,'RESI,RLSE,RINC,LAND,MOBI,FARM,COMS,COML,BUSO',Active,314012,314000,20150721T0000,20150122T0000,1.4.0,HI,http://ddwiki.reso.org/display/DDW16/HI,52
StateOrProvince,KS,The state in which the listing is located is Kansas.,'Kansas, Kans.',,'RESI,RLSE,RINC,LAND,MOBI,FARM,COMS,COML,BUSO',Active,314017,314000,20150721T0000,20150122T0000,1.4.0,KS,http://ddwiki.reso.org/display/DDW16/KS,52
StateOrProvince,NV,The state in which the listing is located is Nevada.,'Nevada, Nev.',,'RESI,RLSE,RINC,LAND,MOBI,FARM,COMS,COML,BUSO',Active,314034,314000,20150721T0000,20150122T0000,1.4.0,NV,http://ddwiki.reso.org/display/DDW16/NV,52
StateOrProvince,OR,The state in which the listing is located is Oregon.,'Oregon, Oreg.',,'RESI,RLSE,RINC,LAND,MOBI,FARM,COMS,COML,BUSO',Active,314038,314000,20150721T0000,20150122T0000,1.4.0,OR,http://ddwiki.reso.org/display/DDW16/OR,52
StreetDirection,NE,The street suffix or prefix direction is North East.,,,'RESI,RLSE,RINC,LAND,MOBI,FARM,COMS,COML,BUSO',Active,372003,372000,20160621T0000,20151209T0000,1.5.0,NE (StreetDirection),http://ddwiki.reso.org/pages/viewpage.action?pageId=19405203,52
StreetDirection,NW,The street suffix or prefix direction is North West.,,,'RESI,RLSE,RINC,LAND,MOBI,FARM,COMS,COML,BUSO',Active,372004,372000,20160621T0000,20151209T0000,1.5.0,NW,http://ddwiki.reso.org/display/DDW16/NW,52
StreetDirection,SE,The street suffix or prefix direction is South East.,,,'RESI,RLSE,RINC,LAND,MOBI,FARM,COMS,COML,BUSO',Active,372006,372000,20160621T0000,20151209T0000,1.5.0,SE (StreetDirection),http://ddwiki.reso.org/pages/viewpage.action?pageId=19405206,52
StreetDirection,SW,The street suffix or prefix direction is South West.,,,'RESI,RLSE,RINC,LAND,MOBI,FARM,COMS,COML,BUSO',Active,372007,372000,20160621T0000,20151209T0000,1.5.0,SW,http://ddwiki.reso.org/display/DDW16/SW,52
TaxStatusCurrent,Personal And Real,The tax is based on both personal and real property.,,,MOBI,Active,418002,418000,20170806T0000,20161207T0000,1.6.0,Personal And Real,http://ddwiki.reso.org/display/DDW16/Personal+And+Real,52
AssociationFeeIncludes,Gas,Gas is included in the fee paid to the Association.,,,'RESI,RLSE,RINC,LAND,MOBI',Active,320004,320000,20150721T0000,20150122T0000,1.4.0,Gas,http://ddwiki.reso.org/display/DDW16/Gas,51
BusinessType,Professional Service,The listing is for a professional service business.,,,'COMS,COML,BUSO',Active,306058,306000,20150721T0000,20150122T0000,1.4.0,Professional Service,http://ddwiki.reso.org/display/DDW16/Professional+Service,51
ConstructionMaterials,Adobe,The structure was made wholly or partly with adobe.,,,'RESI,RLSE,RINC,MOBI,FARM,COMS,COML',Active,355001,355000,20160621T0000,20151209T0000,1.5.0,Adobe,http://ddwiki.reso.org/display/DDW16/Adobe,51
ConstructionMaterials,Block,The structure was made wholly or partly with block.,,,'RESI,RLSE,RINC,MOBI,FARM,COMS,COML',Active,355005,355000,20160621T0000,20151209T0000,1.5.0,Block,http://ddwiki.reso.org/display/DDW16/Block,51
ConstructionMaterials,Brick,The structure was made wholly or partly with brick.,,,'RESI,RLSE,RINC,MOBI,FARM,COMS,COML',Active,355008,355000,20160621T0000,20151209T0000,1.5.0,Brick,http://ddwiki.reso.org/display/DDW16/Brick,51
ConstructionMaterials,Cedar,The structure was made wholly or partly with cedar.,,,'RESI,RLSE,RINC,MOBI,FARM,COMS,COML',Active,355010,355000,20160621T0000,20151209T0000,1.5.0,Cedar,http://ddwiki.reso.org/display/DDW16/Cedar,51
ConstructionMaterials,Frame,The structure was made wholly or partly with frame.,,,'RESI,RLSE,RINC,MOBI,FARM,COMS,COML',Active,355017,355000,20160621T0000,20151209T0000,1.5.0,Frame,http://ddwiki.reso.org/display/DDW16/Frame,51
ConstructionMaterials,Glass,The structure was made wholly or partly with glass.,,,'RESI,RLSE,RINC,MOBI,FARM,COMS,COML',Active,355018,355000,20160621T0000,20151209T0000,1.5.0,Glass,http://ddwiki.reso.org/display/DDW16/Glass,51
ConstructionMaterials,Other,The structure was made wholly or partly with other.,,,'RESI,RLSE,RINC,MOBI,FARM,COMS,COML',Active,355027,355000,20160621T0000,20151209T0000,1.5.0,Other (ConstructionMaterials),http://ddwiki.reso.org/pages/viewpage.action?pageId=19403412,51
ConstructionMaterials,Stone,The structure was made wholly or partly with stone.,,,'RESI,RLSE,RINC,MOBI,FARM,COMS,COML',Active,355038,355000,20160621T0000,20151209T0000,1.5.0,Stone,http://ddwiki.reso.org/display/DDW16/Stone,51
ConstructionMaterials,Straw,The structure was made wholly or partly with straw.,,,'RESI,RLSE,RINC,MOBI,FARM,COMS,COML',Active,355040,355000,20160621T0000,20151209T0000,1.5.0,Straw,http://ddwiki.reso.org/display/DDW16/Straw,51
CurrentUse,Commercial,The land is currently used for commercial purposes.,,,LAND,Active,394004,394000,20170806T0000,20161207T0000,1.6.0,Commercial (CurrentUse),http://ddwiki.reso.org/pages/viewpage.action?pageId=19403775,51
CurrentUse,Industrial,The land is currently used for industrial purposes.,,,LAND,Active,394012,394000,20170806T0000,20161207T0000,1.6.0,Industrial (CurrentUse),http://ddwiki.reso.org/pages/viewpage.action?pageId=19403783,51
LockBoxType,Supra,The lockbox is from Supra and requires a Supra key.,,,'RESI,RLSE,RINC,LAND,MOBI,FARM,COMS,COML,BUSO',Active,364007,364000,20160621T0000,20151209T0000,1.5.0,Supra,http://ddwiki.reso.org/display/DDW16/Supra,51
LotSizeSource,Owner,The owner provided the measurement of the lot size.,,,'RESI,RLSE,RINC,LAND,MOBI,FARM,COMS,COML,BUSO',Active,365006,365000,20160621T0000,20151209T0000,1.5.0,Owner (LotSizeSource),http://ddwiki.reso.org/pages/viewpage.action?pageId=19404467,51
PreferredAddress,Other,The contact prefers the use of their other address.,,,Contacts,Active,408002,408000,20170806T0000,20161207T0000,1.6.0,Other (PreferredAddress),http://ddwiki.reso.org/pages/viewpage.action?pageId=19404891,51
Skirt,None,The mobile/manufactured home does not have a skirt.,,,MOBI,Active,371011,371000,20160621T0000,20151209T0000,1.5.0,None (Skirt),http://ddwiki.reso.org/pages/viewpage.action?pageId=19405088,51
SpecialListingConditions,Real Estate Owned,The listed property is currently bank/lender owned.,,,'RESI,RLSE,RINC,LAND,MOBI,FARM,COMS,COML,BUSO',Active,344006,344000,20150721T0000,20150122T0000,1.4.0,Real Estate Owned,http://ddwiki.reso.org/display/DDW16/Real+Estate+Owned,51
StateOrProvince,ID,The state in which the listing is located is Idaho.,Idaho,,'RESI,RLSE,RINC,LAND,MOBI,FARM,COMS,COML,BUSO',Active,314014,314000,20150721T0000,20150122T0000,1.4.0,ID (StateOrProvince),http://ddwiki.reso.org/pages/viewpage.action?pageId=19405150,51
StateOrProvince,ME,The state in which the listing is located is Maine.,Maine,,'RESI,RLSE,RINC,LAND,MOBI,FARM,COMS,COML,BUSO',Active,314022,314000,20150721T0000,20150122T0000,1.4.0,ME (StateOrProvince),http://ddwiki.reso.org/pages/viewpage.action?pageId=19405159,51
StateOrProvince,TX,The state in which the listing is located is Texas.,'Texas, Tex.',,'RESI,RLSE,RINC,LAND,MOBI,FARM,COMS,COML,BUSO',Active,314044,314000,20150721T0000,20150122T0000,1.4.0,TX,http://ddwiki.reso.org/display/DDW16/TX,51
StructureType,Industrial,A commercial structure designed for industrial use.,,,'COMS,COML',Active,438011,438000,20170806T0000,20170502T0000,1.6.0,Industrial (StructureType),http://ddwiki.reso.org/pages/viewpage.action?pageId=19405246,51
Utilities,Cable Not Available,Cable is not available in the area of the property.,,,'RESI,RLSE,RINC,LAND,MOBI,FARM,COMS,COML',Active,375003,375000,20160621T0000,20151209T0000,1.5.0,Cable Not Available,http://ddwiki.reso.org/display/DDW16/Cable+Not+Available,51
WaterSource,Well,'The property''s source of water has/includes a well.',,,'RESI,RLSE,RINC,LAND,MOBI,FARM,COMS,COML',Active,376009,376000,20160621T0000,20151209T0000,1.5.0,Well,http://ddwiki.reso.org/display/DDW16/Well,51
AreaSource,Appraiser,An appraiser provided the measurement of the area.,,,'RESI,RLSE,RINC,MOBI,FARM,COMS,COML',Active,349001,349000,20160621T0000,20151209T0000,1.5.0,Appraiser,http://ddwiki.reso.org/display/DDW16/Appraiser,50
AreaSource,Assessor,The assessor provided the measurement of the area.,,,'RESI,RLSE,RINC,MOBI,FARM,COMS,COML',Active,349002,349000,20160621T0000,20151209T0000,1.5.0,Assessor,http://ddwiki.reso.org/display/DDW16/Assessor,50
BusinessType,Mobile/Trailer Park,The listing is for a mobile/trailer park business.,,,'COMS,COML,BUSO',Active,306052,306000,20150721T0000,20150122T0000,1.4.0,Mobile/Trailer Park,http://ddwiki.reso.org/pages/viewpage.action?pageId=19403257,50
BusinessType,Professional/Office,The listing is for a professional/office business.,,,'COMS,COML,BUSO',Active,306059,306000,20150721T0000,20150122T0000,1.4.0,Professional/Office,http://ddwiki.reso.org/pages/viewpage.action?pageId=19403269,50
CurrentUse,Grazing,The land is currently used for live stock grazing.,,,LAND,Active,394008,394000,20170806T0000,20161207T0000,1.6.0,Grazing,http://ddwiki.reso.org/display/DDW16/Grazing,50
CurrentUse,Place of Worship,The land is currently used for a place or worship.,,,LAND,Active,394025,394000,20170806T0000,20161207T0000,1.6.0,Place of Worship,http://ddwiki.reso.org/display/DDW16/Place+of+Worship,50
LinearUnits,Feet,The elevation of the property is measured in feet.,,,'RESI,RLSE,RINC,LAND,MOBI,FARM',Active,359001,359000,20160621T0000,20151209T0000,1.5.0,Feet,http://ddwiki.reso.org/display/DDW16/Feet,50
ListingTerms,All Inclusive Trust Deed,The property is under an all inclusive trust deed.,,,'RESI,RLSE,RINC,LAND,MOBI,FARM,COMS,COML,BUSO',Active,333002,333000,20150721T0000,20150122T0000,1.4.0,All Inclusive Trust Deed,http://ddwiki.reso.org/display/DDW16/All+Inclusive+Trust+Deed,50
LotDimensionsSource,Public Records,The lot dimensions were taken from public records.,,,'RESI,RLSE,RINC,LAND,MOBI,FARM,COMS,COML,BUSO',Active,400009,400000,20170806T0000,20161207T0000,1.6.0,Public Records (LotDimensionsSource),http://ddwiki.reso.org/pages/viewpage.action?pageId=19404516,50
LotDimensionsSource,Survey,The lot dimensions were provided by a land survey.,,,'RESI,RLSE,RINC,LAND,MOBI,FARM,COMS,COML,BUSO',Active,400011,400000,20170806T0000,20161207T0000,1.6.0,Survey,http://ddwiki.reso.org/display/DDW16/Survey,50
MemberType,Association Staff,'The member is a member of the association''s staff.',,,'Member,TeamMembers',Active,336001,336000,20150721T0000,20150812T0000,1.4.0,Association Staff,http://ddwiki.reso.org/display/DDW16/Association+Staff,50
OperatingExpenseIncludes,Legal,The operating expense amount includes legal costs.,,,RINC,Active,339012,339000,20150721T0000,20150122T0000,1.4.0,Legal,http://ddwiki.reso.org/display/DDW16/Legal,50
OperatingExpenseIncludes,Other,The operating expense amount includes other costs.,,,RINC,Active,339020,339000,20150721T0000,20150122T0000,1.4.0,Other (OperatingExpenseIncludes),http://ddwiki.reso.org/pages/viewpage.action?pageId=19404654,50
OperatingExpenseIncludes,Staff,The operating expense amount includes staff costs.,,,RINC,Active,339027,339000,20150721T0000,20150122T0000,1.4.0,Staff,http://ddwiki.reso.org/display/DDW16/Staff,50
OperatingExpenseIncludes,Trash,The operating expense amount includes trash costs.,,,RINC,Active,339029,339000,20150721T0000,20150122T0000,1.4.0,Trash (OperatingExpenseIncludes),http://ddwiki.reso.org/pages/viewpage.action?pageId=19404663,50
OwnerPays,Common Area Maintenance,The owner/lessor pays for common area maintenance.,,,'RLSE,RINC,COMS,COML',Active,366004,366000,20160621T0000,20151209T0000,1.5.0,Common Area Maintenance,http://ddwiki.reso.org/display/DDW16/Common+Area+Maintenance,50
Permission,Public,The image or document may be viewed by the public.,,,Media,Active,406006,406000,20170806T0000,20161207T0000,1.6.0,Public (Permission),http://ddwiki.reso.org/pages/viewpage.action?pageId=19404853,50
PreferredAddress,Home,The contact prefers the use of their home address.,,,Contacts,Active,408001,408000,20170806T0000,20161207T0000,1.6.0,Home (PreferredAddress),http://ddwiki.reso.org/pages/viewpage.action?pageId=19404890,50
PreferredAddress,Work,The contact prefers the use of their work address.,,,Contacts,Active,408003,408000,20170806T0000,20161207T0000,1.6.0,Work,http://ddwiki.reso.org/display/DDW16/Work,50
PreferredPhone,Direct,The contact prefers the use of their direct phone.,,,Contacts,Active,409001,409000,20170806T0000,20161207T0000,1.6.0,Direct (PreferredPhone),http://ddwiki.reso.org/pages/viewpage.action?pageId=19404894,50
PreferredPhone,Mobile,The contact prefers the use of their mobile phone.,,,Contacts,Active,409003,409000,20170806T0000,20161207T0000,1.6.0,Mobile (PreferredPhone),http://ddwiki.reso.org/pages/viewpage.action?pageId=19404896,50
PreferredPhone,Office,The contact prefers the use of their office phone.,,,Contacts,Active,409004,409000,20170806T0000,20161207T0000,1.6.0,Office (PreferredPhone),http://ddwiki.reso.org/pages/viewpage.action?pageId=19404897,50
PropertySubType,Boat Slip,A place where you can tie up a boat or house boat.,Slip,,'RESI,RLSE,LAND',Active,302002,302000,20111109T0000,20111109T0000,,Boat Slip,http://ddwiki.reso.org/display/DDW16/Boat+Slip,50
PropertySubType,Business,The property is designed for any type of business.,,,'COMS,COML',Active,302021,302000,20170806T0000,20161024T0000,1.6.0,Business (PropertySubType),http://ddwiki.reso.org/pages/viewpage.action?pageId=19404828,50
Roof,See Remarks,'See the listing''s remarks for details on the roof.',,,'RESI,RLSE,RINC,MOBI,FARM,COMS,COML',Active,369025,369000,20160621T0000,20151209T0000,1.5.0,See Remarks (Roof),http://ddwiki.reso.org/pages/viewpage.action?pageId=19404946,50
Roof,Spanish Tile,The roof is made wholly/partially of Spanish tile.,,,'RESI,RLSE,RINC,MOBI,FARM,COMS,COML',Active,369029,369000,20160621T0000,20151209T0000,1.5.0,Spanish Tile,http://ddwiki.reso.org/display/DDW16/Spanish+Tile,50
StateOrProvince,IA,The state in which the listing is located is Iowa.,Iowa,,'RESI,RLSE,RINC,LAND,MOBI,FARM,COMS,COML,BUSO',Active,314013,314000,20150721T0000,20150122T0000,1.4.0,IA,http://ddwiki.reso.org/display/DDW16/IA,50
StateOrProvince,OH,The state in which the listing is located is Ohio.,'Ohio, Ohio',,'RESI,RLSE,RINC,LAND,MOBI,FARM,COMS,COML,BUSO',Active,314036,314000,20150721T0000,20150122T0000,1.4.0,OH,http://ddwiki.reso.org/display/DDW16/OH,50
StateOrProvince,UT,The state in which the listing is located is Utah.,'Utah, Utah',,'RESI,RLSE,RINC,LAND,MOBI,FARM,COMS,COML,BUSO',Active,314045,314000,20150721T0000,20150122T0000,1.4.0,UT,http://ddwiki.reso.org/display/DDW16/UT,50
ActorType,Unknown,The generating Actor type could not be identified,,,InternetTracking Resource,Active,427005,427000,20170806T0000,20170502T0000,1.6.0,Unknown (ActorType),http://ddwiki.reso.org/pages/viewpage.action?pageId=19403167,49
